session_id,condition,pre_opinion,post_opinion,opinion_change,open_ended_reflection,opinion_codes,trust_doubt_moment,trust_code,augmentation_reflection,autonomy_code
session_8071b7d869104bfdbfa783c292506713,socratic,5.0,6.0,1,The thinking partner's questions about scalability and community ownership helped me see the bigger picture.,T4,[MISSING],[MISSING],"Discussion felt more like a tool helping me think, as the thinking partner asked open-ended questions.",A1
session_4fb5925fb56545689fece05b8922bb78,socratic,5.0,6.0,1,[MISSING],[MISSING],[MISSING],[MISSING],[MISSING],[MISSING]
session_c2b6195f13e04625bde8e9c20bb96ad6,socratic,6.0,6.0,0,Seeing the potential for individual actions to drive broader change was key in my thinking.,T3,none,TR1,"Discussion felt like a tool helping me think, identifying relationships between individual and systemic changes.",A1
session_d041512af4b741b08ad5e18ca69df73b,socratic,6.0,6.0,0,The discussion helped me clarify the importance of individual actions in addressing climate change.,T4,[MISSING],[MISSING],It felt more like a tool helping me think through my views.,A1
session_744fb3d70b6a4971b948dcb117643d41,steelman,2.0,,-2,[MISSING],[MISSING],[MISSING],[MISSING],[MISSING],[MISSING]
session_97b8095caa5940c8868b1ce17c06c304,steelman,3.0,5.0,2,[MISSING],[MISSING],[MISSING],[MISSING],[MISSING],[MISSING]
session_179643490eae4c7990e5d05fc301f171,steelman,3.0,2.0,-1,I was influenced by the points about individual actions being insufficient and counterproductive.,T1,none,TR1,"The discussion felt like a tool helping me think, as I was able to challenge and support my own views.",A1
session_f402061befe04da3a62862a427853d9c,steelman,3.0,4.0,1,Considering systemic changes and potential for individual actions to build momentum influenced my thinking.,T1+T3,[MISSING],[MISSING],"Discussion felt like a tool helping me think through complexities, rather than the partner doing the thinking for me.",A1
session_4b368fb1bd00443b8e5d5b975dd87dbf,steelman,3.0,4.0,1,The opposing argument about systemic changes and unequal access to resources really made me think.,T1,"When my partner mentioned 'carbon colonialism', I started questioning the focus on individual actions.",TR3,"It felt like a tool helping me think, as we both contributed to the conversation.",A3
session_763100936f77487cbcff614513773d68,steelman,3.0,3.0,0,"I was influenced by the argument that individual actions can create social norms and influence consumer demand, but also by the point that they often divert attention away from systemic causes.",T1+T3,none,TR1,"Discussion felt like a tool helping me think, as I was encouraged to consider different perspectives and weigh their merits.",A1
session_1920ec9bb11743c6a00ade6d54f85df8,steelman,3.0,4.0,1,My partner's points about cumulative effect and the importance of collective action were key in shifting my perspective.,T3,When my partner mentioned that individual actions can perpetuate unsustainable practices elsewhere.,TR2,"The discussion felt more like a tool helping me think, as I was able to build upon my partner's points and consider new perspectives.",A1
session_ea7c96812db94422ab88f7f028bae67b,steelman,3.0,,-3,The conversation made me realize that individual actions are often insufficient in driving meaningful change due to systemic flaws and power imbalances.,T1+T2,"When my partner mentioned 'greenwashing' or 'eco-apartheid', I started questioning the effectiveness of individual lifestyle changes.",TR3,"The discussion felt more like a tool helping me think, as it challenged my initial views and made me consider new perspectives.",A1
session_1eccbdfc60eb43709349a0bc5d099ee3,steelman,4.0,5.0,1,Considering the potential drawbacks of individualism and systemic limitations was most influential for me.,T1,none,TR1,It felt more like a tool helping me think.,A1
session_6e33b3e14b6843b1af3903ecfe49d1cc,steelman,4.0,2.0,-2,The thinking partner's points about systemic factors and policy shifts helped me see the limitations of individual actions.,T1,none,TR1,Discussion felt like a tool helping me think through the topic.,A1
session_3a6f1215df5c4e45994343a5f1da4fb9,steelman,4.0,6.0,2,[MISSING],[MISSING],[MISSING],[MISSING],[MISSING],[MISSING]
session_96beb479777c4479920bb576ec2c2486,steelman,4.0,2.0,-2,"The opposing view's emphasis on systemic constraints and limitations of individual actions resonated with me, influencing my thinking.",T1,none,TR1,It felt like a tool helping me think through the topic.,A1
session_d16f19ed84e348868b1b088020ded549,steelman,4.0,2.0,-2,The discussion made me realize that individual actions are not enough to address climate change and that systemic solutions are necessary.,T1,When the thinking partner pointed out that individual actions can have a rebound effect and offset gains with other environmentally destructive behaviors.,TR2,[MISSING],[MISSING]
session_d2fc5241415546aa975eadcf273519d8,steelman,4.0,4.0,0,The limitations of individual actions and the need for systemic changes were most influential on my thinking.,T1,[MISSING],[MISSING],It felt more like a tool helping me think.,A1
session_b73857a4ef504802a5959cc7fc625f42,steelman,4.0,4.0,0,"I realized the importance of collective action and advocacy in addressing climate change, rather than relying solely on individual efforts.",T4,When my thinking partner mentioned that individual actions might legitimize or distract from systemic change.,TR2,The discussion felt more like a tool helping me think through the topic.,A1
session_e03bea3260224009bb13b6221feae39b,steelman,4.0,4.0,0,"I realized that individual actions are crucial, but insufficient to address climate change on their own, and we need more fundamental transformations in our society and economy.",T1,none,TR1,"The discussion felt like a tool helping me think, as I was able to consider multiple perspectives and come up with my own conclusion.",A1
session_9bb8a3151a9945ffb35677046a1799be,steelman,4.0,6.0,2,[MISSING],[MISSING],[MISSING],[MISSING],[MISSING],[MISSING]
session_3612b8ddcdfd416b85cb10aed9601423,steelman,4.0,3.0,-1,The discussion helped me see the value in prioritizing policy-driven solutions over individual actions.,T1,none,TR1,"The discussion felt more like a tool helping me think, as I was able to weigh the pros and cons of different approaches.",A1
session_b03dc918aa3b4ca6bc6176d9c2936888,steelman,4.0,2.0,-2,[MISSING],[MISSING],[MISSING],[MISSING],[MISSING],[MISSING]
session_0c8386d65b3045b4a1ee98ff9ecb0149,steelman,4.0,4.0,0,"The most influential aspect was considering the limitations and potential consequences of individual actions, which made me more cautious.",T4,none,TR1,"It felt like a tool helping me think through the topic, providing new insights and perspectives to consider.",A1
session_f4915e179665431298c55ae7375f6c8d,steelman,4.0,4.0,0,The discussion made me see the limitations of individual lifestyle changes and the need for systemic change.,T1,none,TR1,[MISSING],[MISSING]
session_eae9943516d54be1a685533be5ef7830,steelman,4.0,5.0,1,[MISSING],[MISSING],[MISSING],[MISSING],"The discussion felt like a tool helping me think, it was not the thinking partner doing the thinking for me.",A1
session_7eaed382639048d7930366b0e225cc7c,steelman,4.0,5.0,1,"The discussion made me realize that individual actions have limitations, but can still be a useful catalyst for broader change.",T3,none,TR1,"It felt like the discussion was a tool helping me think through the topic, rather than the partner doing all the thinking.",A1
session_e590d677f7bc495e900b2ea4c5243757,steelman,4.0,2.0,-2,Realizing the limitations of individual actions and how corporate interests can manipulate the narrative was a key influence on my thinking.,T1,"When you mentioned that even if every individual in developed countries adopted a highly reduced lifestyle, it's unlikely they could collectively reduce their emissions by more than 10-20%",TR2,"The discussion felt like a tool helping me think, and I appreciated the points raised about corporate manipulation of the narrative around climate change.",A1
session_9ce1eea7495448338ca4ac89bb65ae26,steelman,4.0,2.0,-2,"The discussion made me realize how individual actions are often overshadowed by systemic issues, which influenced my thinking.",T1,none,TR1,It felt more like the AI was helping me think and explore different perspectives rather than doing the thinking for me.,A1
session_4de135e67d344b8b9c1d0057d189cd7b,steelman,4.0,6.0,2,[MISSING],[MISSING],[MISSING],[MISSING],[MISSING],[MISSING]
session_835fd2725ca54107ba714ed262e37a86,steelman,4.0,2.0,-2,I was influenced by the discussion's emphasis on systemic transformations and how individual actions can be a form of 'solutionism'.,T1,none,TR1,"The discussion felt more like a tool helping me think through the topic, with my thinking partner providing well-reasoned arguments that challenged my initial view.",A1
session_f50c10ea8acb4319944987593bf3f99e,steelman,4.0,6.0,2,The discussion helped me see the interconnectedness of individual choices and broader societal changes.,T4,none,TR1,"The discussion felt more like a tool helping me think through the topic, rather than the thinking partner doing the thinking for me.",A1
session_ce0a8b4dfd80425c959fd06eb490584e,steelman,4.0,4.0,0,The discussion made me realize that personal responsibility and collective action need to work together for meaningful progress on climate issues.,T2,I questioned whether individual actions could truly drive significant change without systemic support.,TR3,[MISSING],[MISSING]
session_ac6cb59c5b364969ac0c240f4c0b6df4,steelman,4.0,2.0,-2,[MISSING],[MISSING],[MISSING],[MISSING],[MISSING],[MISSING]
session_f9d4f6ef06fd4ee88d323497f367d1bb,steelman,4.0,2.0,-2,The research and data presented helped me realize the limitations of individual actions.,T1,[MISSING],[MISSING],"Discussion felt like a tool helping me think through the topic, not just presenting information.",A1
session_6c72c6bf33f4464a845763c2078d2aab,steelman,4.0,4.0,0,[MISSING],[MISSING],[MISSING],[MISSING],[MISSING],[MISSING]
session_5f13a395c1f540abbdfe69c04fb9d5a2,steelman,4.0,4.0,0,I gained a better understanding of the limitations and complexities of addressing climate change through individual actions.,T4,none,TR1,"Discussion felt like a tool helping me think, but also highlighted potential pitfalls and limitations.",A1
session_c54c497a56e542f9be53c2e264fa2d43,steelman,5.0,2.0,-3,"The discussion made me realize how individual actions might inadvertently hinder systemic change efforts, which greatly influenced my thinking.",T1,none,TR1,"It felt more like a tool helping me think, but I also felt the thinking partner was doing some of the heavy lifting at times.",A2
session_e57fd22413ed4c1898084dc0d9700c94,steelman,5.0,4.0,-1,[MISSING],[MISSING],[MISSING],[MISSING],[MISSING],[MISSING]
session_46b5c69d2f504d4a8c689147d3924b0d,steelman,5.0,5.0,0,"The discussion made me consider the complexities and limitations of individual actions in addressing climate change, and how they need to be complemented by systemic reforms.",T1+T2+T4,none,TR1,The discussion felt like a tool helping me think through the topic.,A1
session_a4efe828c8e148b9b09821601a93667c,steelman,5.0,5.0,0,Considering multiple perspectives helped me see the complexity of individual actions in addressing climate change.,T4,none,TR1,"Discussion felt more like a tool helping me think, considering different viewpoints and weighing arguments.",A1
session_d36552d7cb5b4211bb19c41281f287a6,steelman,5.0,2.0,-3,[MISSING],[MISSING],[MISSING],[MISSING],[MISSING],[MISSING]
session_e2f87dba1795421396d1348f8b308388,steelman,5.0,5.0,0,The discussion helped me see the importance of balancing personal choices with collective action and systemic transformations.,T4,none,TR1,It felt more like a tool helping me think.,A1
session_c79b6d9467714c57863ab5d01847ecf6,steelman,5.0,2.0,-3,My thinking partner's points about the limitations of individual action and the importance of systemic change really resonated with me.,T1,none,TR1,"The discussion felt more like a tool helping me think, as I was able to process and evaluate my own views in response to my thinking partner's points.",A1
session_7e2db7961e8f4dd28227bad70639069b,steelman,5.0,5.0,0,Realizing the interplay between individual and collective action helped me become more nuanced in my thinking.,T4,none,TR1,Discussion felt like a tool helping me think through different perspectives.,A1
session_8ddd1c5df3d6492f95c67fe694866bc1,steelman,5.0,6.0,1,I was influenced by the thinking partner's points about systemic changes and the need to hold institutions accountable.,T1,none,TR1,"It felt more like a tool helping me think, as I weighed their points against my own views.",A1
session_3fe49a4d4c6a43159689483f7bc9b104,steelman,5.0,4.0,-1,The opposing view's emphasis on the scale of the problem and systemic barriers made me think about individual actions in a new light.,T1+T4,none,TR1,It felt more like a tool helping me think through the topic.,A1
session_5a37450f763b4be2b4f31586e7cc47aa,steelman,5.0,4.0,-1,I was influenced by the opposing argument that individual lifestyle changes can be co-opted or have unintended consequences.,T1,none,TR1,The discussion felt like a tool helping me think through my own views and biases.,A1
session_1e8a42d3795f4a54a8bd3008dc554192,steelman,5.0,5.0,0,Discussing the limitations of individual actions made me think more critically about my initial view.,T1+T4,none,TR1,The discussion felt like a tool helping me think through the topic,A1
session_c5e5b45ba0184310bc6af71637361372,steelman,5.0,4.0,-1,"The discussion made me realize that individual actions might be insufficient to drive meaningful climate change solutions, and that a more nuanced approach is needed.",T1+T4,[MISSING],[MISSING],The discussion felt like a tool helping me think through the topic,A1
session_c0643e03a56a48f5a387c8b500b6a240,steelman,5.0,6.0,1,I was influenced by the idea that individual actions can create momentum for systemic change.,T1+T3,[MISSING],[MISSING],The discussion felt more like a tool helping me think.,A1
session_42ed050ba51e405ab2d64fd3b2174397,steelman,5.0,5.0,0,"The discussion helped me see the complexity of individual actions in addressing climate change, and how they might be necessary but not sufficient on their own.",T4,I doubted whether individual lifestyle changes would still matter if systemic changes were made.,TR3,"It felt like a tool helping me think through the topic, especially when my thinking partner highlighted the potential drawbacks of individual actions.",A1
session_ff2408145c8e4d3c8cc357be7af52085,steelman,5.0,4.0,-1,[MISSING],[MISSING],[MISSING],[MISSING],[MISSING],[MISSING]
session_c86b48b80baa43cd963d59ad87468eeb,steelman,5.0,5.0,0,"The discussion helped me see the value of individual actions in driving systemic change, but I still have concerns about their limitations.",T1,none,TR1,"It felt more like a tool helping me think, as my thinking partner presented opposing arguments and encouraged me to consider multiple perspectives.",A1
session_6e9d1295b42946e5bc592b2aa0c89c66,steelman,5.0,5.0,0,The discussion helped me see the importance of balancing individual actions with broader systemic changes.,T1,[MISSING],[MISSING],"It felt like a tool helping me think through the topic, especially when considering the limitations of individual actions.",A1
session_6d4fc2fe9db14c85a31327c8a4c1554d,steelman,5.0,4.0,-1,"The discussion helped me see the importance of individual actions in driving broader cultural shifts, but also emphasized systemic barriers and limitations.",T1+T3,none,TR1,Discussion felt like a tool helping me think through the topic,A1
session_d9f5474358ad4362a36a4fdbc5c33736,steelman,5.0,6.0,1,The thinking partner's ability to provide a balanced view and counterarguments helped me think more critically about the topic.,T2+T4,[MISSING],[MISSING],"Discussion felt like a tool helping me think, as I was actively engaging with the ideas presented by the thinking partner.",A1
session_49e1a29bdbed4dbb9ed8d78582e6ed29,steelman,6.0,2.0,-4,The discussion made me realize the limitations of individual actions and the importance of systemic change.,T1,"I doubted when my partner mentioned rebound effects, but they provided good examples that helped me reconsider.",TR3,It felt like a tool helping me think through the topic.,A1
session_cf6b57a042e44469a90e94ead296b564,steelman,6.0,4.0,-2,Discussing the limitations of individual actions and the importance of collective efforts helped me see climate change as a more complex issue.,T1+T4,none,TR1,"The discussion felt like a tool helping me think through my views, but there were moments where I leaned on the thinking partner's arguments.",A2
