session_id,condition,pre_opinion,post_opinion,opinion_change,open_ended_reflection,opinion_codes,trust_doubt_moment,trust_code,augmentation_reflection,autonomy_code
session_4ca6c1238b2b4abda792b591705e915e,neutral,2.0,6.0,4,Discussing the multiplier effect of individual actions and their potential to influence social norms was most influential.,T3,none,TR1,"The discussion felt more like a tool helping me think, as I was able to build upon my initial views with new information.",A1
session_6d1f4d37e5b643c7b11787434c646967,neutral,2.0,5.0,3,The conversation helped me see how individual actions can contribute to a broader cultural shift towards sustainability.,T3,none,TR1,"It felt like the discussion was helping me think through the topic, not just presenting information.",A1
session_219021e224394636b11589cd692ad33f,neutral,3.0,5.0,2,I realized that individual actions can have a significant impact when combined with larger-scale changes.,T2,none,TR1,The discussion felt more like a tool helping me think about the topic.,A1
session_02700163bb624e27ad68ac9d4e03c549,neutral,3.0,5.0,2,"I think I was most influenced by the discussion of how individual actions fit into a broader context, rather than being isolated.",T4,none,TR1,It felt more like we were exploring and finding solutions together.,A1
session_c62372d4fd48480fb10f0c19b88b14d2,neutral,3.0,5.0,2,The discussion highlighted the need for a multi-faceted approach to climate change mitigation.,T2+T4,none,TR1,It felt more like a tool helping me think.,A1
session_cd6df7c8c82242748e6ec8cebf4f04a2,neutral,4.0,6.0,2,[MISSING],[MISSING],[MISSING],[MISSING],[MISSING],[MISSING]
session_e5822e338a564ac9b2a889cc8b2b130d,neutral,4.0,5.0,1,[MISSING],[MISSING],[MISSING],[MISSING],[MISSING],[MISSING]
session_5b666d6f53544abf93e11c49e60334eb,neutral,4.0,5.0,1,The conversation made me realize the importance of individual actions in driving policy change.,T4,none,TR1,"Discussion felt more like a tool helping me think, as I was able to articulate my thoughts and build on them.",A1
session_d014f80a7c78407b9c23633727b07e1f,neutral,4.0,6.0,2,"The discussion made me realize that individual actions are important but also limited, and that systemic changes are necessary to make significant reductions in emissions.",T1,"When the thinking partner mentioned that even if every household replaced all their light bulbs with energy-efficient ones, it would only reduce overall emissions by around 1-2%",TR2,The discussion felt more like a tool helping me think through the topic rather than the thinking partner doing the thinking for me.,A1
session_7862ae8e15a444359b28f5b03c797672,neutral,4.0,5.0,1,The discussion helped me see the value of individual actions in driving broader cultural shifts towards sustainability.,T3,none,TR1,"It felt like a tool helping me think, as I was actively considering and weighing different perspectives.",A1
session_d58c2b98c62848a494b0c0a4d28fd51a,neutral,4.0,7.0,3,The conversation helped me see the value in individual actions contributing to larger systemic changes.,T1,none,TR1,It felt more like a tool helping me think through the topic.,A1
session_d2208faccf1e41dc9d4956e03d34a2eb,neutral,4.0,5.0,1,[MISSING],[MISSING],[MISSING],[MISSING],[MISSING],[MISSING]
session_14f4c9f0c7cc440b863ab3049fb2e8b0,neutral,4.0,5.0,1,[MISSING],[MISSING],[MISSING],[MISSING],[MISSING],[MISSING]
session_673014f831884b7d9702bcd48fcb4ba9,neutral,4.0,5.0,1,Realizing the importance of both individual and systemic changes helped me feel more hopeful about making a difference.,T1+T2,none,TR1,"The discussion felt like a tool helping me think, as my partner's input encouraged me to consider different perspectives.",A1
session_e981a06030ba4edc968d26ad3fff61e9,neutral,4.0,5.0,1,"I think my view on individual lifestyle changes being necessary to address climate change is shifting because I see how collective action can make a difference, but also recognize that bigger systemic changes are needed.",T1,none,TR1,It felt like the discussion was helping me think through the topic rather than doing the thinking for me.,A1
session_1b42284d11b844e5a537532fddf9c5d3,neutral,4.0,6.0,2,[MISSING],[MISSING],[MISSING],[MISSING],[MISSING],[MISSING]
session_2cd5216b1db54c279fc984d06387266e,neutral,4.0,5.0,1,"I was influenced by the idea that individual actions can create a cultural shift, leading to broader changes in behavior and policy.",T3,[MISSING],[MISSING],"The discussion felt more like a tool helping me think, as my thinking partner presented new perspectives and helped me synthesize information.",A1
session_d4255f1a354548de92c29fefc3f21cd2,neutral,4.0,6.0,2,[MISSING],[MISSING],[MISSING],[MISSING],[MISSING],[MISSING]
session_3bde8098963143e9a4952833cf5cb702,neutral,4.0,5.0,1,The discussion showed me how individual actions can be a catalyst for broader change.,T3,none,TR1,It felt more like the thinking partner was helping me think through the topic.,A1
session_1a484d5cb4d94fdab2040adf5f4c5d0d,neutral,4.0,6.0,2,I think the combination of individual actions and systemic changes is necessary to address climate change.,T1+T2,none,TR1,"It felt like a tool helping me think, but sometimes I needed time to process what you were saying.",A1
session_4527542e2fec4c11b3952a5f7263beb5,neutral,4.0,7.0,3,The discussion helped me see the value in individual actions and how they can collectively drive broader systemic changes. This perspective shift was most influential.,T1+T3,none,TR1,"It felt more like a tool helping me think, as our exchange allowed me to refine my understanding of the topic.",A1
session_e34206b960a04e78ab34428abda5e165,neutral,4.0,6.0,2,Discussion helped me see the importance of individual actions in driving systemic change.,T1,none,TR1,"Discussion felt like a tool helping me think through the topic, rather than thinking for me.",A1
session_01d30d3d3d3145b4bd6fe3978ab73ec0,neutral,4.0,5.0,1,The conversation's focus on the importance of both individual actions and systemic changes helped me see a more comprehensive approach to addressing climate change.,T1+T2,[MISSING],[MISSING],It felt like a tool helping me think.,A1
session_ff3f398d5cfa4c67b5c17677b89dd266,neutral,4.0,6.0,2,[MISSING],[MISSING],none,TR1,"The discussion felt more like a tool helping me think, as it encouraged me to consider different perspectives and nuances.",A1
session_c6c3690a0ef6406db9f72ca6016bf13d,neutral,4.0,7.0,3,The discussion made me realize the importance of individual actions in driving systemic change.,T1,none,TR1,It felt more like a tool helping me think through my own views and doubts.,A1
session_be4b737a82074b67bdbff94c2f3e7b29,neutral,4.0,4.0,0,The discussion helped me see the importance of systemic changes in addressing climate change.,T1,none,TR1,"It felt like a tool helping me think, but sometimes I worried it was doing too much of the thinking for me.",A2
session_d620bc979a4c4a11a257cda1b4b4b8ea,neutral,4.0,6.0,2,The combination of individual and systemic change approaches helped me understand the complexity of addressing climate change.,T1+T2+T4,none,TR1,"It felt like a tool helping me think, as I was able to weigh the pros and cons of different approaches.",A1
session_2beb50e6056349569484ee824401dce1,neutral,4.0,6.0,2,[MISSING],[MISSING],[MISSING],[MISSING],[MISSING],[MISSING]
session_f5c944c2b3124a93b07744176b22dae7,neutral,4.0,6.0,2,[MISSING],[MISSING],[MISSING],[MISSING],[MISSING],[MISSING]
session_250940e116254c559dd04c969afd7a72,neutral,4.0,6.0,2,Seeing the importance of systemic change in addition to individual actions helped me shift my view.,T1,none,TR1,The discussion felt like a tool helping me think through the topic.,A1
session_6d48392607494cc8871c95d8e8702222,neutral,4.0,5.0,1,"The moment that most influenced my thinking was when you mentioned the tipping point approach, where grassroots efforts build momentum and push decision-makers to implement more comprehensive solutions.",T2+T3,none,TR1,"It felt like a tool helping me think, as I was able to consider new perspectives and reflect on my own views.",A1
session_ca7a1afd3e004f2880acad910e404106,neutral,4.0,6.0,2,[MISSING],[MISSING],[MISSING],[MISSING],[MISSING],[MISSING]
session_732084a878ab494e9c1b18ff9a9d9c5a,neutral,4.0,5.0,1,Seeing the collective impact of individual actions helped me understand their value in addressing climate change.,T3,none,TR1,"The discussion felt like a tool helping me think through the topic, but I did feel some influence from my thinking partner's perspectives.",A2
session_4648de73f55c463bab33a7adf79c283c,neutral,4.0,5.0,1,The discussion helped me see the value in combining individual actions with policy support.,T4,none,TR1,It felt like a tool helping me think through the topic.,A1
session_9ccce20eb35f422296f881a4aa57a79a,neutral,5.0,6.0,1,Realizing the multiplier effect of individual actions and combining them with collective efforts helped me see the bigger picture.,T3+T4,[MISSING],[MISSING],"Discussion felt more like a tool helping me think, as I was able to explore my own ideas and build upon them.",A1
session_4d945e89cac04fc1b0aab3f8cf9646ab,neutral,5.0,6.0,1,The nuanced discussion helped me see that individual actions can add up to significant changes over time.,T4,[MISSING],[MISSING],It felt more like a tool helping me think.,A1
session_98656e8b961444828ca3e559e16f9e77,neutral,5.0,6.0,1,Realizing the interdependence between individual actions and systemic change influenced my thinking.,T1,none,TR1,Discussion felt like a tool helping me think.,A1
session_1314b503adc641ceb9f50762d5449699,neutral,5.0,6.0,1,Seeing the collective impact of individual actions helped me feel more motivated to make sustainable choices.,T3,[MISSING],[MISSING],"Discussion felt like a tool helping me think, as my partner's points made me consider new perspectives.",A1
session_a38d1f6094c34cc8bd5e724b9068c641,neutral,5.0,2.0,-3,"The discussion helped me see the importance of systemic changes in addressing climate change, and how individual actions can be a catalyst for larger shifts.",T1+T3,[MISSING],[MISSING],"It felt like the thinking partner was helping me think through the topic, pointing out important considerations I hadn't thought about.",A1
session_9a28491ad9094e1c9276eaed4d97ddc9,neutral,5.0,6.0,1,The discussion helped me see the importance of balancing individual actions with systemic changes.,T1,none,TR1,"It felt like a tool helping me think, as it challenged my views and encouraged me to consider different perspectives.",A1
session_c7bbdfa934044134a4b3b7581c1b7d34,neutral,5.0,6.0,1,[MISSING],[MISSING],[MISSING],[MISSING],[MISSING],[MISSING]
session_d2abf703dbe745a185ddc32d91762286,neutral,5.0,6.0,1,The thinking partner's arguments and points made me realize the importance of individual actions in creating a ripple effect.,T3,none,TR1,It felt like a tool helping me think.,A1
session_c1bf7bb92cee42a18a49876267cbd6dc,neutral,5.0,6.0,1,The thinking partner's points about systemic changes and individual actions working together really resonated with me.,T1+T2,none,TR1,[MISSING],[MISSING]
session_b856b0ff6fc04cc1976f7a47e75ccdf4,neutral,5.0,5.0,0,[MISSING],[MISSING],[MISSING],[MISSING],[MISSING],[MISSING]
session_99ed367f34014ae4bfe9a445ad24c430,neutral,5.0,6.0,1,The discussion helped me see the value of policy-led solutions in addressing climate change.,T4,none,TR1,"It felt more like a tool helping me think, as it made me consider multiple perspectives and approaches.",A1
session_742aef86844e41b69378d3abc5ec1ecd,neutral,5.0,7.0,2,Realizing that individual actions need to be combined with broader societal and policy changes helped me understand the complexity of climate change.,T1+T2+T4,none,TR1,"The discussion felt more like a tool helping me think, as it challenged my initial view and made me consider new perspectives.",A1
session_8f6cde6aec804a51bb9e88eca1dfe396,neutral,5.0,6.0,1,I was influenced by the examples of how individual actions can have a cumulative effect when combined with policy changes.,T1+T2+T3,none,TR1,"The discussion felt more like a tool helping me think, as I was encouraged to consider different perspectives and weigh my own opinions.",A1
session_9059b5e3baf64792a366c1e7705b8588,neutral,5.0,6.0,1,[MISSING],[MISSING],[MISSING],[MISSING],[MISSING],[MISSING]
session_0ae5d52464d04f3e823db3a89b246bf3,neutral,5.0,7.0,2,Realizing the potential for collective impact on climate change was a key moment.,T3,none,TR1,Discussion felt like a tool helping me think through my views.,A1
session_6498a131fb1a4bf3a469acec81a9f839,neutral,5.0,6.0,1,Discussing individual vs systemic changes helped me see the value of collective action.,T1,none,TR1,Discussion felt more like a tool helping me think through ideas.,A1
session_e0776417ead54d85a9e62e49ad8371cc,neutral,6.0,7.0,1,I was most influenced by seeing how individual actions can have a multiplier effect when combined with policy changes.,T1+T2+T3,none,TR1,"The discussion felt like a tool helping me think, as I was actively considering the points and adjusting my view accordingly.",A1
session_1dac02f7141d48ffbf48d23e76f90ba3,neutral,6.0,4.0,-2,The discussion helped me see the limitations of individual action and the need for systemic changes.,T1,I questioned how effective individual actions like reducing meat consumption could be in driving significant emissions reductions without broader policy changes.,TR3,"It felt more like a tool helping me think, as we explored different perspectives and ideas together.",A1
session_f1139aca2c2d4f39ab1134566c3cc96f,neutral,,,0,[MISSING],[MISSING],[MISSING],[MISSING],[MISSING],[MISSING]
session_a244d65f83e54b46abafb4e6547b098a,socratic,2.0,5.0,3,[MISSING],[MISSING],[MISSING],[MISSING],[MISSING],[MISSING]
session_35c5c625bb3f4d108e8a4103cf3671a9,socratic,2.0,4.0,2,Discussing data-driven outcomes and their potential impact helped me reconsider my initial stance.,T4,[MISSING],[MISSING],"The discussion felt more like a tool helping me think, as I was encouraged to consider different perspectives.",A1
session_4db0c872aa104b6d8de5ce59d54c55b8,socratic,3.0,6.0,3,"I was most influenced by the idea that individual actions can have a ripple effect, but that policy changes are also crucial.",T1+T3,none,TR1,It felt like the discussion was helping me think through the topic rather than doing the thinking for me.,A1
session_2293fd31842049be9c292593c979d028,socratic,3.0,5.0,2,The discussion helped me see the value in community-led initiatives and local policies supporting sustainable lifestyles.,T4,"When my partner said that individual actions can add up over time, I doubted it at first but then realized it's true.",TR2,The discussion felt more like a tool helping me think through the topic rather than someone thinking for me.,A1
session_96e78cbb43a94b50af7f682d1f786bce,socratic,3.0,5.0,2,[MISSING],[MISSING],[MISSING],[MISSING],[MISSING],[MISSING]
session_52b39d1ee298438ea95cc1bcb8ddd35a,socratic,3.0,5.0,2,The discussion made me think about how individual actions can build momentum and eventually drive systemic change.,T1+T3,none,TR1,"It felt more like a tool helping me think, but there were moments when I questioned the thinking partner's perspective.",A1
session_b199566cdec14ddfa40e8a64cd53e212,socratic,3.0,4.0,1,"Seeing the value in individual actions, even when combined with a sense of collective responsibility.",T2,none,TR1,It felt more like a tool helping me think.,A1
session_e4ffd52ae85e41b898086cc360e2410b,socratic,4.0,5.0,1,"The discussion made me realize that individual actions can have a snowball effect, but it's also important to consider collective efforts.",T3,[MISSING],[MISSING],It felt more like the thinking partner was helping me think through the topic.,A1
session_ba29423ce127415eba9dfd220876782c,socratic,4.0,5.0,1,[MISSING],[MISSING],[MISSING],[MISSING],[MISSING],[MISSING]
session_75db14af87dd44daad868179ff252f40,socratic,4.0,5.0,1,Realizing that individual actions can be a catalyst for broader systemic change was a key moment.,T1+T3,none,TR1,"It felt like we were working together, using the thinking partner as a tool to explore my thoughts.",A1
session_921a63ac2f314dfca2d6e74d40c22d49,socratic,4.0,5.0,1,Discussing the importance of collective momentum in driving systemic change helped me think more critically about individual actions.,T1+T3+T4,[MISSING],[MISSING],"The discussion felt like a tool helping me think through the topic, but I sometimes wondered if my thinking partner was leading me towards a specific conclusion.",A2
session_3707c7b8d6274ff7b68c8440632b0f0d,socratic,4.0,5.0,1,[MISSING],[MISSING],[MISSING],[MISSING],[MISSING],[MISSING]
session_ab371c5da938457d8481e588a7440e95,socratic,4.0,5.0,1,[MISSING],[MISSING],[MISSING],[MISSING],[MISSING],[MISSING]
session_acb24f8ee09b42e090ff1fa914eee9af,socratic,4.0,4.0,0,Considering systemic barriers made me think more critically about individual actions' impact.,T1+T4,none,TR1,[MISSING],[MISSING]
session_7fc6dcd2172043668cab5497518172c4,socratic,4.0,5.0,1,"The discussion helped me see the potential for individual actions to create momentum, but also the need for clear goals and tangible results.",T3,[MISSING],[MISSING],"It felt like a tool helping me think, as I was able to articulate my own views and doubts more clearly.",A1
session_c9fb46ade69e460dabf1a9267a1ccb01,socratic,4.0,5.0,1,The conversation helped me see individual efforts as part of a larger cultural shift.,T3,none,TR1,"Felt like the discussion was helping me think through my own ideas, but also provided useful frameworks for considering individual vs collective impact.",A1
session_801243f0c3c74d17a62a214e46e2d921,socratic,4.0,5.0,1,The discussion helped me see the importance of individual actions in building momentum for policy change.,T3,[MISSING],[MISSING],"It felt more like a tool helping me think through the topic, but there were moments where I wasn't sure if we were having a meaningful exchange or just going through the motions.",A2
session_4dd4c2cac21849fcbec4ff2c96ece1fe,socratic,4.0,5.0,1,[MISSING],[MISSING],[MISSING],[MISSING],[MISSING],[MISSING]
session_f52fd7454eae46759ac707494d5b6992,socratic,4.0,6.0,2,Reflecting on the discussion helped me understand how individual actions can influence social norms and drive systemic change.,T1+T3,none,TR1,"The discussion felt more like a tool helping me think, as partner's questions and points made me consider new perspectives.",A1
session_39bea3c6bff342dc973fadeb3c907bf1,socratic,4.0,6.0,2,Discussing the ripple effect of individual actions helped me see their potential to drive broader systemic changes.,T1+T3,none,TR1,The discussion felt like a tool helping me think through my own perspectives and ideas.,A1
session_f60e44d40d894765b112cae9b73db18a,socratic,4.0,,-4,Realizing that individual actions can influence systemic change helped me shift my perspective on the importance of personal choices.,T1,none,TR1,"It felt like a tool helping me think through different perspectives, rather than just presenting new information.",A1
session_7d96c8b70a3d42878415b77decd84156,socratic,4.0,6.0,2,[MISSING],[MISSING],[MISSING],[MISSING],[MISSING],[MISSING]
session_103c066fd599470399a122d112b9d750,socratic,4.0,5.0,1,"Reflecting on the discussion, I started to see individual actions as a catalyst for broader systemic change.",T1+T3,[MISSING],[MISSING],"The discussion felt like a tool helping me think, allowing me to explore new perspectives and insights.",A1
session_1fb2dcdc0ab44b1b8a620324990b9a8f,socratic,4.0,5.0,1,"The discussion helped me see individual actions as part of a larger system, not just isolated efforts.",T4,none,TR1,"It felt more like a tool helping me think, especially when discussing the importance of systemic changes.",A1
session_5e28e853300c418ca1524e3bc5ecedb8,socratic,4.0,6.0,2,Considering institutions' role and potential for collective impact influenced my thinking.,T3,none,TR1,"Discussion felt like a tool helping me think, considering different perspectives.",A1
session_49a9b1abc1e6460393607d21b96271f9,socratic,4.0,5.0,1,I gained confidence that individual actions are part of a broader solution when I see collective momentum.,T3,[MISSING],[MISSING],"The discussion felt like a tool helping me think, making connections and challenging my assumptions.",A1
session_5a211757ae3c4005af223f40d3dd9899,socratic,4.0,5.0,1,Seeing the interplay between individual and systemic actions helped me shift my perspective.,T4,none,TR1,"Discussion felt more like a tool helping me think, as we explored different perspectives together.",A1
session_79d98d3750274cb6a53c36fa84605eed,socratic,4.0,5.0,1,[MISSING],[MISSING],[MISSING],[MISSING],[MISSING],[MISSING]
session_13da026406fe49c9af9df14239481ed3,socratic,4.0,5.0,1,"Realizing that individual actions can be a catalyst for change, not just a response to it.",T3,[MISSING],[MISSING],Discussion felt more like a tool helping me think.,A1
session_c2fb21916c9c4864957d12aee683fa30,socratic,4.0,5.0,1,[MISSING],[MISSING],[MISSING],[MISSING],[MISSING],[MISSING]
session_211cab96140744be9d599757eb19213c,socratic,4.0,5.0,1,Realizing the importance of psychological and social value connected to individual actions changed my perspective.,T4,[MISSING],[MISSING],"Discussion felt more like a tool helping me think, especially when considering unintended consequences.",A1
session_a6f0e9e9b4404ad7aa8927459673b825,socratic,4.0,5.0,1,[MISSING],[MISSING],[MISSING],[MISSING],[MISSING],[MISSING]
session_9f880777262d45c79514b3b2029167b3,socratic,4.0,4.0,0,The discussion helped me see the importance of systemic changes in addressing climate change.,T1,none,TR1,"It felt like a tool helping me think, but sometimes I worried it was leading me to certain conclusions.",A2
session_a285e05ce9c844e2934495a1aec34d86,socratic,4.0,6.0,2,The conversation helped me see the importance of both individual and systemic changes in addressing climate change.,T1+T2,none,TR1,"It felt more like a tool helping me think, as it challenged my initial views and made me consider new perspectives.",A1
session_6050960485574abcb43dd029debce7ce,socratic,4.0,5.0,1,"Realizing individual actions are more responsive to systemic conditions, rather than drivers of change themselves, influenced my thinking.",T4,[MISSING],[MISSING],Discussion felt like a tool helping me think.,A1
session_3243ccac881b4f5596269ea038b07aae,socratic,4.0,5.0,1,I was most influenced by the discussion's exploration of individual actions within a broader policy context.,T4,none,TR1,The discussion felt like a tool helping me think through the topic.,A1
session_57e1687182934edf92117964f617cd7e,socratic,4.0,5.0,1,[MISSING],[MISSING],[MISSING],[MISSING],[MISSING],[MISSING]
session_88e89eafb708437687d02f6a293cd826,socratic,4.0,6.0,2,Discussing the limitations of individual actions and the need for collective action helped me think more critically about climate change.,T1+T4,[MISSING],[MISSING],"The discussion felt like a tool helping me think, as I was able to build on my partner's questions and ideas.",A1
session_ed5ececedaf24e19a20687de9b90f775,socratic,5.0,5.0,0,"The discussion made me realize the importance of addressing systemic issues alongside individual actions, and how collective action can drive change.",T1+T2,none,TR1,It felt more like a tool helping me think through my own perspectives.,A1
session_c09eb109248747c9b735aefbbfcd913f,socratic,5.0,6.0,1,I was influenced by the discussion's emphasis on collective action and community-led initiatives.,T4,none,TR1,The discussion felt more like a tool helping me think through my own thoughts and ideas.,A1
session_8f16166f5cc442049a1848d7d0c41fdf,socratic,5.0,6.0,1,[MISSING],[MISSING],[MISSING],[MISSING],[MISSING],[MISSING]
session_e43e0b7dd9f84ed2b51213b239d9b541,socratic,5.0,6.0,1,[MISSING],[MISSING],[MISSING],[MISSING],[MISSING],[MISSING]
session_2fa9728fd3d741ddb22067b156d90f14,socratic,5.0,5.0,0,I think what most influenced my thinking was the idea that individual actions can create pressure for policy changes.,T1,none,TR1,The discussion felt more like a tool helping me think through the topic.,A1
session_0336ff0198b04101b8df7112ea776cc6,socratic,5.0,6.0,1,"Considering the collective impact of individual actions and social norms, I'm more inclined to believe in their significance.",T3,none,TR1,"The discussion felt like a tool helping me think, as my partner's questions nudged me towards considering different perspectives.",A1
session_3845044d44b84e1dbbe2d9ec3ceb12e7,socratic,5.0,4.0,-1,Realizing individual lifestyle changes' role in influencing social norms was the most influential aspect of our discussion.,T3,[MISSING],[MISSING],"Discussion felt more like a tool helping me think, as I had to weigh the pros and cons and come up with my own conclusions.",A1
session_aa315e99ca58443ea0a8974ef2f6d9ff,socratic,5.0,5.0,0,"Reflecting on the discussion, I realized that individual lifestyle changes are often assumed to be universally possible and effective, which isn't always true.",T4,none,TR1,The discussion felt like a tool helping me think through my own thoughts and assumptions.,A1
session_ab45a4c2909b461b9e785a3c3bdf2274,socratic,5.0,5.0,0,"Considering the discussion, I think individual actions are necessary but not sufficient to address climate change.",T4,none,TR1,It felt like a tool helping me think through the topic.,A1
session_25bf641f9dd8461d83809cb1ea27d239,socratic,5.0,6.0,1,"The discussion helped me see that individual actions can be part of a larger strategy for systemic change, rather than just personal feelings of efficacy.",T1,[MISSING],[MISSING],It felt more like the thinking partner was helping me think through the topic and consider new perspectives.,A1
session_1d80a83b53ab4db2a4fed6891e0a86ef,socratic,5.0,5.0,0,"I realized that individual lifestyle changes have value beyond just their impact on climate change, which helped me solidify my view.",T5,none,TR1,The discussion felt more like a tool helping me think through the topic and consider different perspectives.,A1
